Authors,Title,Year,Source title,DI,Abstract,Author Keywords,Publication Stage,Open Access,Source,EID,OpenAlex_KW
Zhao Y.; Yu H.; Li J.; Qian J.; Li M.; Zhang X.; Wang M.; Wang Y.; Dong Y.; You Y.; Zhou Q.; Gao D.; Zhao Y.; Liu B.; Chen R.; Ren Z.; Wang Z.; Zhang K.; Cui J.,A glucose-enriched lung pre-metastatic niche triggered by matrix stiffness-tuned exosomal miRNAs in hepatocellular carcinoma,2025,Nature Communications ,10.1038/s41467-025-56878-8,"Apart from the classic features, it is almost unknown whether there exist other new pathological features during pre-metastatic niche formation in hepatocellular carcinoma (HCC). Our previous works have highlighted the contribution of increased matrix stiffness to lung pre-metastatic niche formation and metastasis in HCC. However, whether increased matrix stiffness influences glucose metabolism and supply of lung pre-metastatic niche remains largely unclear. Here we uncover the underlying mechanism by which matrix stiffness-tuned exosomal miRNAs as the major contributor modulate glucose enrichment during lung pre-metastatic niche formation through decreasing the glucose uptake and consumption of lung fibroblasts and increasing angiogenesis and vascular permeability. Our findings suggest that glucose enrichment, a new characteristic of the lung pre-metastatic niche triggered by matrix stiffness-tuned exosomal miRNAs, is essential for the colonization and survival of metastatic tumor cells, as well as subsequent metastatic foci growth. © The Author(s) 2025.",,Final,All Open Access; Gold Open Access,Scopus,2-s2.0-85218490603,[WARNING:NoKeywords]
Arango-Argoty G.; Kipkogei E.; Stewart R.; Sun G.J.; Patra A.; Kagiampakis I.; Jacob E.,Pretrained transformers applied to clinical studies improve predictions of treatment efficacy and associated biomarkers,2025,Nature Communications ,10.1038/s41467-025-57181-2,"Cancer treatment has made significant advancements in recent decades, however many patients still experience treatment failure or resistance. Attempts to identify determinants of response have been hampered by a lack of tools that simultaneously accommodate smaller datasets, sparse or missing measurements, multimodal clinicogenomic data, and that can be interpreted to extract biological or clinical insights. We introduce the Clinical Transformer, an explainable transformer-based deep-learning framework that addresses these challenges. Our framework maximizes data via self-supervised, gradual, and transfer learning, and yields survival predictions surpassing performance of state-of-the-art methods across diverse, independent datasets. The framework’s generative capability enables in silico perturbation experiments to test counterfactual hypotheses. By perturbing immune-associated features in immunotherapy-naive patients, we identify a patient subset that may benefit from immunotherapy, and we validate this finding across three independent immunotherapy-treated cohorts. We anticipate our work will empower the scientific community to further harness data for the benefit of patients. © The Author(s) 2025.",,Final,All Open Access; Gold Open Access; Green Open Access,Scopus,2-s2.0-85219606253,[WARNING:NoKeywords]
Sevilla-González M.; Smith K.; Wang N.; Jensen A.E.; Litkowski E.M.; Kim H.; DiCorpo D.A.; Hsu S.; Cui J.; Liu C.-T.; Yu C.; McNeil J.J.; Lacaze P.; Westerman K.E.; Chang K.-M.; Tsao P.S.; Phillips L.S.; Goodarzi M.O.; Sladek R.; Rotter J.I.; Dupuis J.; Florez J.C.; Merino J.; Meigs J.B.; Zhou J.J.; Raghavan S.; Udler M.S.; Manning A.K.,Heterogeneous effects of genetic variants and traits associated with fasting insulin on cardiometabolic outcomes,2025,Nature Communications ,10.1038/s41467-025-57452-y,"Elevated fasting insulin levels (FI), indicative of altered insulin secretion and sensitivity, may precede type 2 diabetes (T2D) and cardiovascular disease onset. In this study, we group FI-associated genetic variants based on their genetic and phenotypic similarities and identify seven clusters with distinct mechanisms contributing to elevated FI levels. Clusters fall into two types: “non-diabetogenic hyperinsulinemia,” where clusters are not associated with increased T2D risk, and “diabetogenic hyperinsulinemia,” where T2D associations are driven by body fat distribution, liver function, circulating lipids, or inflammation. In over 1.1 million multi-ancestry individuals, we demonstrated that diabetogenic hyperinsulinemia cluster-specific polygenic scores exhibit varying risks for cardiovascular conditions, including coronary artery disease, myocardial infarction (MI), and stroke. Notably, the visceral adiposity cluster shows sex-specific effects for MI risk in males without T2D. This study underscores processes that decouple elevated FI levels from T2D and cardiovascular risk, offering new avenues for investigating process-specific pathways of disease. © The Author(s) 2025.",,Final,All Open Access; Gold Open Access,Scopus,2-s2.0-105000163664,[WARNING:NoKeywords]
Zhu L.; Song G.; Zhang W.; Wu Y.; Chen Y.; Song J.; Wang D.; Li G.; Tang B.Z.; Li Y.,Aggregation induced emission luminogen bacteria hybrid bionic robot for multimodal phototheranostics and immunotherapy,2025,Nature Communications ,10.1038/s41467-025-57533-y,"Multimodal phototheranostics utilizing single molecules offer a “one-and-done” approach, presenting a convenient and effective strategy for cancer therapy. However, therapies based on conventional photosensitizers often suffer from limitations such as a single photosensitizing mechanism, restricted tumor penetration and retention, and the requirement for multiple irradiations, which significantly constrain their application. In this report, we present an aggregation-induced emission luminogen (AIEgen) bacteria hybrid bionic robot to address above issues. This bionic robot is composed of multifunctional AIEgen (INX-2) and Escherichia coli Nissle 1917 (EcN), i.e., EcN@INX-2. The EcN@INX-2 bionic robot exhibits near-infrared II (NIR-II) fluorescence emission and demonstrates efficient photodynamic and photothermal effects, as well as tumor-targeting capabilities. These features are facilitated by the complementary roles of INX-2 and EcN. The robot successfully enables in vivo multimodal imaging and therapy of colon cancer models in female mice through various mechanisms, including the activation of anti-tumor immunity, as well as photodynamic and photothermal therapy. Our study paves an avenue for designing multifunctional diagnostic agents for targeted colon cancer therapy through image-guided combinational immunotherapy. © The Author(s) 2025.",,Final,All Open Access; Gold Open Access,Scopus,2-s2.0-105000330778,[WARNING:NoKeywords]
Amirrad F.; La V.; Ohadi S.; Albotaif M.; Webster S.; Pru J.K.; Shamloo K.; Mohieldin A.M.; Nauli S.M.,PGRMC2 is a pressure-volume regulator critical for myocardial responses to stress in mice,2025,Nature Communications ,10.1038/s41467-025-57707-8,"Progesterone receptors are classified into nuclear and membrane-bound receptor families. Previous unbiased proteomic studies indicate a potential association between cardiac diseases and the progesterone receptor membrane-bound component-2 (PGRMC2); however, the role of PGRMC2 in the heart remains unknown. In this study, we use a heart-specific knockout (KO) mouse model (MyH6•Pgrmc2flox/flox) in which the Pgrmc2 gene was selectively deleted in cardiomyocytes. Here we show that PGRMC2 serves as a mediator of steroid hormones for rapid calcium signaling in cardiomyocytes to maintain cardiac contraction, sufficient stroke volume, and adequate cardiac output by regulating the cardiac pressure-volume relationship. The KO hearts from male and female mice exhibit an impairment in pressure-volume relationship. Under hypoxic conditions, this pressure-volume dysregulation progresses to congestive left and right ventricular failure in the KO hearts. Overall, we propose that PGRMC2 is a cardiac pressure-volume regulator to maintain normal cardiac physiology, especially during hypoxic stress. © The Author(s) 2025.",,Final,All Open Access; Gold Open Access,Scopus,2-s2.0-105000057298,[WARNING:NoKeywords]
Bhatnagar A.; Thomas C.M.; Nge G.G.; Zaya A.; Dasari R.; Chongtham N.; Manandhar B.; Kortagere S.; Elefant F.,Tip60 HAT activators as therapeutic modulators for Alzheimer’s disease,2025,Nature Communications ,10.1038/s41467-025-58496-w,"Reduced histone acetylation in the brain causes transcriptional dysregulation and cognitive impairment that are key initial steps in Alzheimer’s disease (AD) etiology. Unfortunately, current treatment strategies primarily focus on histone deacetylase inhibition (HDACi) that causes detrimental side effects due to non-specific acetylation. Here, we test Tip60 histone acetyltransferase (HAT) activation as a therapeutic strategy for selectively restoring cognition-associated histone acetylation depleted in AD by developing compounds that enhance Tip60’s neuroprotective HAT function. Several compounds show high Tip60-binding affinity predictions in silico, enhanced Tip60 HAT action in vitro, and restore Tip60 knockdown mediated functional deficits in Drosophila in vivo. Furthermore, compounds prevent neuronal deficits and lethality in an AD-associated amyloid precursor protein neurodegenerative Drosophila model and remarkably, restore expression of repressed neuroplasticity genes in the AD brain, underscoring compound specificity and therapeutic effectiveness. Our results highlight Tip60 HAT activators as a promising therapeutic neuroepigenetic modulator strategy for AD treatment. © The Author(s) 2025.",,Final,,Scopus,2-s2.0-105002976622,[WARNING:NoKeywords]
Pullin J.; Rodríguez-Celma J.; Franceschetti M.; Mundy J.E.A.; Svistunenko D.A.; Bradley J.M.; Le Brun N.E.; Balk J.,Iron-sensing and redox properties of the hemerythrin-like domains of Arabidopsis BRUTUS and BRUTUS-LIKE2 proteins,2025,Nature Communications ,10.1038/s41467-025-58853-9,"Iron uptake in plants is negatively regulated by highly conserved hemerythrin (Hr) E3 ubiquitin ligases exemplified by Arabidopsis thaliana BRUTUS (BTS). Physiological studies suggest these are the elusive plant iron sensors, but biochemical evidence is lacking. Here we demonstrate that the N-terminal domains of BTS and BTS-LIKE2 (BTSL2) respectively bind three and two diiron centres within three closely packed Hr-like subdomains. The centres can be reversibly oxidized by O2 and H2O2, resulting in a di-Fe3+ form that is non-labile. In the reduced state, a proportion of the iron becomes labile, based on accessibility to Fe2+ chelators and reconstitution experiments, consistent with dynamic iron binding. Impaired iron binding and altered redox properties in the BTS dgl variant correlate with diminished capacity to suppress the downstream signalling cascade. These data provide the biochemical foundation for a mechanistic model of how BTS/Ls function as iron sensors that are unique to the plant kingdom. © The Author(s) 2025.",,Final,All Open Access; Gold Open Access,Scopus,2-s2.0-105003483440,[WARNING:NoKeywords]
Sarker H.; Panigrahi R.; Lopez-Campistrous A.; McMullen T.; Reyes K.; Anderson E.; Krishnan V.; Hernandez-Anzaldo S.; Zheng X.-L.; Glover J.N.M.; Hardy E.; Fernandez-Patron C.,Apolipoprotein-A1 transports and regulates MMP2 in the blood,2025,Nature Communications ,10.1038/s41467-025-59062-0,"Synthesized in the liver and intestines, apolipoprotein A1 (APOA1) transports cholesterol in high density lipoproteins from atherosclerotic lesions to the liver, protecting against atherosclerotic plaque rupture. Here, we show that proMMP2 (zymogen of matrix metalloproteinase-2) circulates associated with APOA1 in humans and APOA1-expressing mice. This is noteworthy because MMP2 is the most abundant MMP in blood, and MMPs promote atherosclerotic plaque rupture. Artificial intelligence (AlphaFold)-based modeling suggested that APOA1 and MMP2 interact; direct interactions were confirmed using five orthogonal interaction assays, showing that APOA1 binds to MMP2 catalytic and hemopexin-like domains. APOA1 inhibited MMP2 autolysis and allosterically increased MMP2 activity—an effect specifically reproduced by plasma from humans and APOA1-expressing mice but not albumin nor plasma from APOA1 knockout mice. These function-altering interactions with APOA1 may increase MMP2 bioavailability and lay the foundation for future research on how apolipoproteins and MMPs influence atherosclerotic plaque rupture, independently of cholesterol transport. © The Author(s) 2025.",,Final,,Scopus,2-s2.0-105003290048,[WARNING:NoKeywords]
Wang X.; Shafiq K.; Ousley D.A.; Chigumba D.N.; Davis D.; McDonough K.M.; Mydy L.S.; Sexton J.Z.; Kersten R.D.,Large-scale transcriptome mining enables macrocyclic diversification and improved bioactivity of the stephanotic acid scaffold,2025,Nature Communications ,10.1038/s41467-025-59428-4,"Nearly 10,000 plant species are represented by RNA-seq datasets in the NCBI sequence read archive, which are difficult to search in unassembled format due to database size. Here, we optimize RNA-seq assembly to transform most of this public RNA-seq data to a searchable database for biosynthetic gene discovery. We test our transcriptome mining pipeline towards the diversification of moroidins, which are plant ribosomally-synthesized and posttranslationally-modified peptides (RiPPs) biosynthesized from copper-dependent peptide cyclases. Moroidins are bicyclic compounds with a conserved stephanotic acid scaffold, which becomes cytotoxic to non-small cell lung adenocarcinoma cells with an additional C-terminal macrocycle. We discover moroidin analogs with second ring structures diversified at the crosslink and the non-crosslinked residues including a moroidin analog from water chickweed, which exhibits higher cytotoxicity against lung adenocarcinoma cells than moroidin. Our study expands stephanotic acid-type peptides to grasses, Lowiaceae, mints, pinks, and spurges while demonstrating that large-scale transcriptome mining can broaden the medicinal chemistry toolbox for chemical and biological exploration of eukaryotic RiPP lead structures. © The Author(s) 2025.",,Final,All Open Access; Gold Open Access,Scopus,2-s2.0-105004342802,[WARNING:NoKeywords]
Liu Z.; Wang D.; Li G.; Yi M.; Zhang Z.; Zhong G.; Xu L.; Jiang R.; Zheng Y.; Huang L.; Peng Y.; Liang L.; Li J.; Liu Y.; Lai J.; Lv X.; Xu Y.; Liu Q.; Wang Z.; Liu Z.; Yang Q.; Nie L.; Lei J.; Huang X.; Liu Z.; Jiang W.,"Neoadjuvant with low-dose radiotherapy, tislelizumab, albumin-bound paclitaxel, and cisplatin for resectable locally advanced head and neck squamous cell carcinoma: phase II single-arm trial",2025,Nature Communications ,10.1038/s41467-025-59865-1,"Although pathological complete response (pCR) and major pathological response (MPR) rates of neoadjuvant immunotherapy combined with chemotherapy in head and neck squamous cell carcinoma (HNSCC) trials remain suboptimal, emerging evidence highlights the synergistic potential of combining low-dose radiotherapy with immunotherapy to promote the efficacy of immunotherapy. This phase II, open-label, single-arm, multicenter trial (NCT05343325) enrolled 28 patients with untreated stage III-IVB HNSCC (NeoRTPC02). Patients received neoadjuvant low-dose radiotherapy, the programmed death-1 (PD-1) inhibitor tislelizumab, albumin-bound paclitaxel, and cisplatin for two cycles, followed by radical resection ~4 weeks after treatment completion. The primary endpoint, pCR rate, was achieved in 14 of 23 patients (60.9%; 23/28, 82.1% of the total cohort underwent surgery). Secondary endpoints included MPR rate (21.7%, 5/23), R0 resection rate (100%), and objective response rate (64.3%; 18/28). Treatment-related adverse events were manageable, with grade 3 or 4 treatment-related adverse events occurring in 10 (35.7%) patients. No surgical delays were observed. Single-cell RNA sequencing revealed remodeling of the HNSCC tumor microenvironment, which may correlate with improved clinical outcomes. This trial met the pre-specified primary endpoint, demonstrating a high pCR rate with promising efficacy and manageable toxicity in locally advanced HNSCC. © The Author(s) 2025.",,Final,,Scopus,2-s2.0-105005464163,[WARNING:NoKeywords]
van der Meer D.; Rahman Z.; Ottas A.; Parekh P.; Kutrolli G.; Stinson S.E.; Koromina M.; Rokicki J.; Sønderby I.E.; Parker N.; Tesfaye M.; Hindley G.; Rødevand L.N.; Koch E.; Võsa U.; Kronberg J.; Abner E.; Taba N.; Palta P.; Hudjashov G.; Nelis M.; Metspalu M.; Mägi R.; Esko T.; Metspalu A.; Steen N.E.; Berg J.P.; O’Connell K.S.; Smeland O.B.; Frei O.; Dale A.M.; Djurovic S.; Lehto K.; Alver M.; Milani L.; Shadrin A.A.; Andreassen O.A.,Pleiotropic and sex-specific genetic mechanisms of circulating metabolic markers,2025,Nature Communications ,10.1038/s41467-025-60058-z,"Metabolites in plasma form biosignatures of a range of common complex human diseases. Discovering variants with pleiotropic effects across metabolites can reveal underlying biological mechanisms. We therefore performed uni- and multivariate genome-wide association studies (GWAS) on 249 circulating metabolic markers across 328,006 UK Biobank and Estonian Biobank participants. We investigated rare variation through whole exome sequencing gene burden tests, analysed the role of body mass index through Mendelian randomization, and performed genome-wide interaction analyses with sex. We discovered 15,585 loci summed over the univariate GWAS, with high pleiotropy across markers, linked to a wide range of disorders. Findings from common and rare variant gene tests converged on lipid homeostasis pathways. 31 loci interacted with sex, mapped to genes involved in cholesterol processing. The findings offer insights into the genetic architecture of circulating metabolites, revealing pleiotropic loci, highlighting the role of rare variation, and uncovering sex-specific molecular mechanisms of lipid metabolism. © The Author(s) 2025.",,Final,,Scopus,2-s2.0-105007084923,[WARNING:NoKeywords]
Schneider R.S.; Nieves E.B.; Aggarwal B.; Bowles-Welch A.C.; Stevens H.Y.; Kippner L.E.; Boden S.D.; Mautner K.; Drissi H.; Roy K.; Lam W.A.; Sinha S.; García A.J.,On-chip 3D potency assay for prediction of clinical outcomes for cell therapy candidates for osteoarthritis,2025,Nature Communications ,10.1038/s41467-025-60158-w,"The lack of clinically predictive potency assays for cell products significantly impedes translation of these therapies. Here, we describe a microfluidic on-chip 3D system for rapid evaluation of a subset of patient-derived bone marrow aspirate concentrate (BMAC) samples used in a phase 3 multicenter trial (NCT03818737) evaluating autologous cells for relieving knee osteoarthritis pain. BMAC clinical samples cultured in the on-chip 3D system exhibit elevated levels of immunomodulatory and trophic proteins compared to 2D culture. Using analyte information from in vitro assays and patient-matched clinical data, we build linear regression prediction models for clinical outcomes. We demonstrate improved clinical prediction by cross-validation accuracy for the on-chip 3D platform compared to 2D culture. Additionally, on-chip 3D assay metrics display higher correlative power with patient pain scores compared to the 2D assay. This study establishes a potency assay with improved prediction power to accelerate translation of cell therapies. © The Author(s) 2025.",,Final,,Scopus,2-s2.0-105006827513,[WARNING:NoKeywords]
Kim D.; Chauhan V.P.; Alamani B.G.; Fisher S.D.; Yang Z.; Jones M.R.; Terlier T.; Vekilov P.G.; Rimer J.D.,Bio-inspired multifunctional disruptors of calcium oxalate crystallization,2025,Nature Communications ,10.1038/s41467-025-60320-4,"Calcium mineralization in biological and geological systems is often regulated by (macro)molecules enriched with anionic functional moieties. Relatively few studies have examined the effects of phosphate-based modifiers that are integral in calcification underlying human bone formation and pathological diseases. Here we mimic posttranslational phosphorylated moieties of a biologically-active inhibitor protein and demonstrate that polyphosphates and phosphonates suppress calcium oxalate nucleation, tailor solvate crystal structure, and irreversibly inhibit crystal growth in ways that significantly deviate from commonly investigated carboxylate-rich modulators of biomineralization. The most potent modifiers exhibit an uncommon dual mode of action, wherein nucleation is suppressed by altering prenucleation clusters and crystal surface growth is impeded irreversibly by inducing lattice strain. Once crystal surfaces are exposed to modifiers, recrystallization is severely restricted. This exemplifies the uniqueness and efficiency of phosphates wherein their multiple modes of action are promising characteristics for designing de novo biologically-inspired molecules as mineralization regulators. © The Author(s) 2025.",,Final,,Scopus,2-s2.0-105007533744,[WARNING:NoKeywords]
Sato M.; Torigoe D.; Kinoshita Y.; Cyuman M.; Toda C.; Sato M.; Ikeda K.; Kadomatsu T.; Horiguchi H.; Morinaga J.; Fukami H.; Sugizaki T.; Miyata K.; Kusaba R.; Okadome Y.; Matsunaga E.; Node K.; Oike Y.,Long-term intake of Tamogi-take mushroom (Pleurotus cornucopiae) mitigates age-related cardiovascular dysfunction and extends healthy life expectancy,2025,npj Aging,10.1038/s41514-024-00191-z,"Age-related declines in cardiac function and exercise tolerance interfere with healthy living and decrease healthy life expectancy in older individuals. Tamogi-take mushrooms (Pleurotus cornucopiae) are known to contain high levels of Ergothioneine (EGT), an antioxidant with potential health benefits. In this study, we assessed the possibility that long-term consumption of Tamogi-take mushrooms might attenuate age-related decline in cardiac and vascular endothelial function in mice. We found that long-term intake of Tamogi-take mushrooms significantly maintained cardiac and vascular endothelial function and improved exercise tolerance in mice. Long-term mushroom consumption also increased levels of Nrf2 (Nuclear factor E2-related factor 2) protein in heart tissues and increased translation of HO-1 (Heme Oxygenase 1) proteins, which have antioxidant effects in heart and aortic tissues. Finally, long-term Tamogi-take mushroom consumption inhibited ROS accumulation with aging and reduced expression of inflammatory biomarkers. We conclude that ingestion of Tamogi-take mushrooms could serve as a dietary intervention to promote cardiovascular health, support healthy aging and slow the progression of age-related diseases. © The Author(s) 2025.",,Final,All Open Access; Green Open Access; Hybrid Gold Open Access,Scopus,2-s2.0-85217011899,[WARNING:NoKeywords]
Blyth R.R.R.; Laversin S.A.; Foxall R.B.; Savva C.; Copson E.; Cutress R.I.; Birts C.N.; Beers S.A.,Development and characterisation of a novel 3D in vitro model of obesity-associated breast cancer as a tool for drug testing,2025,npj Breast Cancer,10.1038/s41523-025-00766-3,"Obesity is associated with worse breast cancer outcomes and decreased therapeutic efficacy. However, the mechanisms driving obesity-associated therapy resistance remain unclear; in part due to a lack of suitable models that recapitulate the obese tumour microenvironment. To address this, we developed a 3D in vitro model of obesity-associated breast cancer, to investigate biological mechanisms and to use as a drug testing tool. A penta-culture system was developed by co-culturing adipocyte spheroids with breast tumour cells, myoepithelial cells, macrophages, and fibroblasts in a collagen matrix. Tumour cells and macrophages infiltrated adipocyte spheroids, replicating the inflamed-adipose border typical of obese patients. This model was then assessed as a drug testing platform. Obese cultures exhibited increased sensitivity to metformin and, conversely, resistance to paclitaxel, compared to non-obese cultures. This 3D organotypic model effectively recapitulates key features of the obese adipose tumour microenvironment, providing a useful tool to interrogate mechanisms underpinning obesity-related therapy resistance. © The Author(s) 2025.",,Final,All Open Access; Gold Open Access; Green Open Access,Scopus,2-s2.0-105006724703,[WARNING:NoKeywords]
