Authors,Title,Year,Source title,DI,Abstract,Author Keywords,Publication Stage,Open Access,Source,EID,OpenAlex_KW
Moreno N.; Korneev K.; Semenov A.; Topuz A.; John T.; Lettinga M.P.; Ellero M.; Wagner C.; Fedosov D.A.,Aggregation and disaggregation of red blood cells: Depletion versus bridging,2025,Biophysical Journal,10.1016/j.bpj.2025.03.007,"The aggregation of red blood cells (RBCs) is a complex phenomenon that strongly impacts blood flow and tissue perfusion. Despite extensive research for more than 50 years, physical mechanisms that govern RBC aggregation are still under debate. Two proposed mechanisms are based on bridging and depletion interactions between RBCs due to the presence of macromolecules in blood plasma. The bridging hypothesis assumes the formation of bonds between RBCs through adsorbing macromolecules, while the depletion mechanism results from the exclusion of macromolecules from the intercellular space, leading to effective attraction. Existing experimental studies generally cannot differentiate between these two aggregation mechanisms, although several recent investigations suggest concurrent involvement of the both mechanisms. We explore dynamic aggregation and disaggregation of two RBCs using three simulation models: a potential-based model mimicking depletion interactions, a bridging model with immobile bonds, and a new bridging model with mobile bonds that can slide along RBC membranes. Simulation results indicate that dynamic aggregation of RBCs primarily arises from depletion interactions, while disaggregation of RBCs involves both mechanisms. The bridging model with mobile bonds reproduces well the corresponding experimental data, offering insights into the interplay between bridging and depletion interactions and providing a framework for studying similar interactions between other biological cells. © 2025 Biophysical Society",,Final,All Open Access; Green Open Access,Scopus,2-s2.0-105002268137,[WARNING:NoKeywords]
Parhad T.H.; Robel F.N.; Bahadur N.M.; Tabassum S.; Dey S.S.; Ali M.F.; Bashar M.S.; Ahmed S.; Sahadat Hossain M.,Preparation of bio-glass and bio-ceramic utilizing sol-gel method and fabrication of bio-scaffolds for drug loading and releasing application,2025,Ceramics International,10.1016/j.ceramint.2025.05.011,"Bioglass and bioceramics are promising materials for biomedical applications due to their bioactivity, biocompatibility, and drug delivery potential. In this study, bioglass and bioceramics composed of CaO, SiO2, P2O5, and Na2O were synthesized via the sol-gel method and characterized to assess their structural, chemical, and thermal properties. X-ray Diffraction (XRD) analysis confirmed their amorphous nature, while Fourier Transform Infrared (FTIR) spectroscopy identified key functional groups (Si–O–Si, P–O) crucial for bioactivity. Thermogravimetric analysis (TGA) determined the degradation temperature up to 700 °C. The synthesized materials were employed as drug delivery matrices for ciprofloxacin (CIP), amoxicillin, and levofloxacin. Levofloxacin exhibited the highest drug-loading capacity (0.75 %), while drug release studies in simulated body fluid (SBF) indicated sustained release, with ciprofloxacin achieving 30 % release and levofloxacin 70 %. Bioceramics exhibited lower drug-loading efficiency compared to bioglass, demonstrating reduced effectiveness as a biomaterial. Among powdered samples, amoxicillin showed 10 % incorporation, with bioglass facilitating the highest release. Antimicrobial activity was evaluated against Gram-positive (S. aureus, B. cereus, L. monocytogenes), Gram-negative (E. coli, S. abony), and fungal (C. albicans) strains. Ciprofloxacin-loaded bioglass exhibited superior efficacy, with a maximum inhibition zone of 33.5 ± 1.32 mm against S. abony, highlighting its potential for antibacterial applications. These findings establish sol-gel-derived bioglass as an efficient platform for controlled drug delivery and antimicrobial therapy. © 2025 Elsevier Ltd and Techna Group S.r.l.",,Final,,Scopus,2-s2.0-105004591774,[WARNING:NoKeywords]
Roy A.; Thompson S.E.; Hodson J.; Win K.Z.; Alvior A.M.; Cumberland M.J.; Ochoa-Ferraro A.; Oxborough D.; Geberhiwot T.; Steeds R.P.,Utilization of Transthoracic Echocardiography and Biochemical Markers in Detecting Cardiomyopathy in Fabry Disease,2025,CJC Open,10.1016/j.cjco.2025.01.017,"Background: Fabry disease (FD) is an X-linked lysosomal storage disorder caused by α-galactosidase A enzyme deficiency, resulting in multiorgan accumulation of glycosphingolipid. Cardiac accumulation leads to left ventricular hypertrophy, diastolic dysfunction, fibrosis, and sudden cardiac death. Advances in transthoracic echocardiograms (TTEs) have enabled the detection of subclinical atrial and ventricular cardiomyopathy. Until now, studies assessing changes on TTE in FD have been small and cross-sectional. To understand longitudinal changes, our aim was to quantify trends in TTE parameters, linked to relevant physiological and biochemical parameters. Methods: A single-centre retrospective study was conducted of 75 FD patients who received longitudinal follow-up care (53% female, 57% on enzyme replacement therapy) between 2011 and 2023. Results: Longitudinal follow-up care demonstrated increasingly impaired left ventricular global longitudinal strain (GLS), tissue Doppler imaging, and right ventricular systolic function. Atrial changes included increasingly impaired left atrial GLS, greater volumes, and reduced left atrial ejection fraction and fractional area change. A sex-specific increase occurred in indexed left ventricular mass in male patients. Biochemical changes included increases in high-sensitivity Troponin-T and N-terminal-pro-B-type natriuretic peptide levels. A sex-specific increase in the urine protein level and the albumin-creatinine ratio in male patients. Conclusions: TTE and biochemical trends highlight the gradual and insidious nature of FD progression, and stress the importance of considering multiparametric endpoints, including GLS, atrial function, and biomarkers, when assessing outcome in FD. © 2025 The Authors",,Final,All Open Access; Gold Open Access,Scopus,2-s2.0-85219080394,[WARNING:NoKeywords]
Liang H.; Xuan Q.; Liu C.; Wan A.; You N.; Xiao M.; Zhang H.; Han M.; Wan G.,Machine learning-assisted tacrolimus dose optimization in childhood- onset systemic lupus erythematosus through population pharmacokinetic modeling,2025,Computers in Biology and Medicine,10.1016/j.compbiomed.2025.110782,"Objective: This study aimed to improve treatment effectiveness in childhood-onset systemic lupus erythematosus (cSLE) by developing machine learning algorithms integrated with pharmacokinetic parameters to predict individualized tacrolimus dosing for optimized therapy. Methods: Data from 480 trough tacrolimus concentrations in 86 cSLE patients over five years were analyzed. A nonlinear mixed-effects model was constructed to characterize the pharmacokinetics of tacrolimus. We screened 27 machine learning and deep learning models using 29 clinical variables to select the best-performing individualized dose prediction model. To further enhance prediction accuracy, the pharmacokinetic parameters were subsequently embedded within the optimized model. Model performance was assessed through the utilization of goodness-of-fit plots and diagnostic parameters such as objective function values and Shapley Additive exPlanations (SHAP) values. Results: The pharmacokinetic profile of tacrolimus was best accurately characterized by a one-compartment model, which incorporated first-order kinetics for both absorption and elimination processes. The typical estimates for apparent clearance (CL/F) and volume of distribution (V/F) were 3.52 L/h/70 kg and 124.84 L/70 kg, respectively. Among the 27 machine learning models, the XGBoost algorithm demonstrated the best prediction accuracy for tacrolimus dose (R2 = 0.74, mean absolute error [MAE] = 0.016, mean square error [MSE] = 0.0005). After incorporating 11 key variables, including pharmacokinetic parameters (CL/F and V/F), into the model and performing hyperparameter turning, prediction accuracy significantly enhanced (R2 = 0.80, MAE = 0.013, MSE = 0.0004). Two cSLE patients who received model-predicted doses achieved disease activity indexes ≤4 after treatment. Conclusion: This study successfully developed an accurate machine learning-based model for predicting individualized tacrolimus dosing in cSLE patients. The integration of pharmacokinetic parameters significantly enhanced the model's accuracy, improving dosing precision and reducing overexposure, thus enhancing therapeutic efficacy. © 2025",,Final,,Scopus,2-s2.0-105010921975,[WARNING:NoKeywords]
Chen J.; Sun Z.; Guo J.; Wang Q.; Chen M.; Zhang B.; Liu Y.; Wang Z.; Feng J.; Feng Y.,Prognostic value of perioperative NER levels combined with Ca199 in cholangiocarcinoma surgery,2025,Current Problems in Surgery,10.1016/j.cpsurg.2025.101719,[No abstract available],,Final,All Open Access; Hybrid Gold Open Access,Scopus,2-s2.0-85219685829,[WARNING:NoKeywords]
