Authors,Title,Year,Source title,DI,Abstract,Author Keywords,Publication Stage,Open Access,Source,EID,OpenAlex_KW
Van Name M.; Ásbjörnsdóttir B.; Gomes M.M.; Hale P.M.; Udupa K.; Vinther S.; Wolf R.M.; Ribel-Madsen R.,Pharmacokinetic Properties of Once-Weekly Insulin Icodec in Children and Adolescents With Type 2 Diabetes,2025,Pediatric Diabetes,10.1155/pedi/5514927,"Background: Young people with type 2 diabetes (T2D) often need basal insulin for diabetes management. Insulin icodec is a novel basal insulin designed for once-weekly administration. Methods: This study investigated the pharmacokinetic properties of icodec in children and adolescents with T2D aged 10 to < 18 years. Eighteen insulin-treated (daily basal insulin dose ≥ 0.2 U/kg) participants (11 females/7 males; mean ± standard deviation body mass index 38.5 ± 7.1 kg/m2, HbA1c 7.5 ± 1.3%) received a single subcutaneous injection of icodec (5.6 U/kg). Blood samples for pharmacokinetic analysis were drawn frequently until 35 days postinjection. Observed single-dose pharmacokinetic profiles were extrapolated to steady state using pharmacokinetic modeling. Results: One-week icodec pharmacokinetic profiles observed after a single dose and extrapolated to steady state suggest that icodec exposure covers the full weekly dosing interval in children and adolescents with T2D. After a single dose, geometric mean total exposure was 819∙105 pmol∙h/L [coefficient of variation (CV) 28.2%] and maximum concentration (Cmax) was 4.22∙105 pmol/L (CV 25.8%). Median time to maximum concentration (tmax) was 21 h (range 12–27 h). When extrapolated to steady state, geometric mean total exposure was 771∙105 pmol∙h/L (CV 29.9%) and maximum concentration was 6.35∙105 pmol/L (CV 27.3%). Median tmax was 15 h (range 13–19 h). In total, six adverse events (AEs) were reported in two participants. All AEs were mild and recovered/resolved. No serious or severe AEs, hypersensitivity or injection site reactions, or hyperglycemic episodes (plasma glucose > 14.0 mmol/L and blood ketones > 1.5 mmol/L) were reported. One level 1 hypoglycemic episode (plasma glucose < 3.9 and ≥ 3.0 mmol/L) was reported. Conclusion: Icodec was safe and well-tolerated in the current study in children and adolescents with T2D. The pharmacokinetic properties of icodec support its potential for once-weekly administration in children and adolescents with T2D. Trial Registration: ClinicalTrials.gov identifier: NCT05790681. Copyright © 2025 Michelle Van Name et al. Pediatric Diabetes published by John Wiley & Sons Ltd.",,Final,All Open Access; Hybrid Gold Open Access,Scopus,2-s2.0-105003102748,[WARNING:NoKeywords]
Tsimberidou A.M.; Vining D.J.; Arora S.P.; de Achaval S.; Larson J.; Kauh J.; Cartwright C.; Avritscher R.; Alibhai I.; Tweardy D.J.; Kaseb A.O.,"Phase I Trial of TTI-101, a First-in-Class Oral Inhibitor of STAT3, in Patients with Advanced Solid Tumors",2025,Clinical Cancer Research,10.1158/1078-0432.CCR-24-2920,"Purpose: Signal transducer and activator of transcription 3 is a transcription factor that is essential for the survival and immune sequestration of cancer cells. We conducted a phase I study of TTI-101, a first-in-class, selective small-molecule inhibitor of signal transducer and activator of transcription 3, in patients with advanced metastatic cancer. Patients and Methods: Patients were treated with TTI-101 orally twice daily in 28-day cycles at four dose levels (DL): 3.2 (DL1), 6.4 (DL2), 12.8 (DL3), and 25.6 (DL4) mg/kg/day (“3+3” design). Three TTI-101 formulations were used in a stepwise manner (NCT03195699). Results: Sixty-four patients were treated (median age, 63 years; male sex, 52%; median number of prior therapies, 3). No dose-limiting toxicities or fatal treatment-related adverse events (TRAE) were observed. Diarrhea (mostly grade 1/2) was the only TRAE observed in ≥30% of subjects. Five patients experienced grade 3 TRAEs that resolved. TTI-101 showed linear pharmacokinetics from DL1 to DL3, with the pharmacokinetics plateauing at DL3. The recommended phase II dose is 12.8 mg/kg/day (DL3). Of the 41 patients who were evaluable for response, five (12%) had confirmed partial responses (cPR) and 17 (41%) had stable disease. Three (18%) of the 17 patients with hepatocellular carcinoma had a cPR (median time to treatment failure, 10.6 months). Two other cPRs were noted in one patient with ovarian cancer and one patient with gastric cancer. Conclusions: TTI-101 was well tolerated. cPRs were observed across tumor types. The antitumor activity of TTI-101 monotherapy in patients with advanced, metastatic solid tumors is promising. A phase II study of TTI-101 in hepatocellular carcinoma is currently underway. ©2025 The Authors.",,Final,All Open Access,Scopus,2-s2.0-105000329220,[WARNING:NoKeywords]
Qiu Y.; Chen A.; Yu R.; Llevenes P.; Seen M.; Ko N.Y.; Monti S.; Denis G.V.,Insulin Resistance Increases TNBC Aggressiveness and Brain Metastasis via Adipocyte-Derived Exosomes,2025,Molecular Cancer Research,10.1158/1541-7786.MCR-24-0494,"Patients with triple-negative breast cancer (TNBC) and comorbid type 2 diabetes (T2D), characterized by insulin resistance of adipose tissue, have a higher risk of metastasis and shorter survival. Adipocytes are the main nonmalignant cells of the breast tumor microenvironment (TME). However, adipocyte metabolism is usually ignored in oncology, and the mechanisms that couple T2D to TNBC outcomes are poorly understood. In this study, we hypothesized that exosomes, small vesicles secreted by TME breast adipocytes, drive epithelial-to-mesenchymal transition (EMT) and metastasis in TNBC via miRNAs. Exosomes were purified from conditioned media of 3T3-L1 mature adipocytes, either insulin-sensitive (IS) or insulin-resistant (IR). Murine 4T1 cells, a TNBC model, were treated with exosomes in vitro (72 hours). EMT, proliferation, and angiogenesis were elevated in IR versus control and IS. Brain metastases showed more mesenchymal morphology and EMT enrichment in the IR group. MiR-145a-3p is highly differentially expressed between IS and IR and potentially regulates metastasis. ©2025 American Association for Cancer Research.",,Final,All Open Access; Green Open Access,Scopus,2-s2.0-105007334553,[WARNING:NoKeywords]
Mullen K.M.; Hong J.; Attiyeh M.A.; Hayashi A.; Sakamoto H.; Kohutek Z.A.; McIntyre C.A.; Zhang H.; Makohon-Moore A.P.; Zucker A.; Wood L.D.; Myers M.A.; Arnold B.J.; Zaccaria S.; Chou J.F.; Capanu M.; Socci N.D.; Raphael B.J.; Iacobuzio-Donahue C.A.,The Evolutionary Forest of Pancreatic Cancer,2025,Cancer Discovery,10.1158/2159-8290.CD-23-1541,"The genomic features of pancreatic ductal adenocarcinoma (PDAC) have been well described, yet the evolutionary contexts within which these features occur remain unexplored. We studied genome landscapes, phylogenies, and clonal compositions of 91 PDACs in relation to clinicopathologic features. There was no difference in the number of driver mutations or evolutionary timing when each mutation occurred. High truncal density, a metric of the accumulation of somatic mutations in the lineage that gave rise to each PDAC, was significantly associated with worse overall survival. Polyclonal, monoclonal, or mixed polyclonal/monoclonal metastases were identified across the cohort, highlighting multiple forms of intertumoral heterogeneity. Advanced stage and treated PDACs had higher odds of being polyclonal, whereas oligometastatic PDACs had fewer driver alterations, a lower fractional allelic loss, and increased likelihood of being monoclonal. In sum, our findings reveal novel insights into the dynamic nature of the PDAC genome beyond established genetic paradigms. Significance: Although the pancreatic cancer genome has been described, it has not been explored with respect to stages of diagnosis or treatment bottlenecks. We now describe and quantify the genomic features of PDAC in the context of evolutionary metrics and in doing so have identified a novel prognostic biomarker. © 2024 The Authors.",,Final,All Open Access; Hybrid Gold Open Access,Scopus,2-s2.0-85218352677,[WARNING:NoKeywords]
Cusick M.; Nair V.; Fermin D.; Hartman J.; Beamish J.A.; Sun Z.; Zhang Z.; Otto E.; Menon R.; Nadimidla S.; Demchuk N.; Shaffer K.; Heeger P.; Zhang W.; Menon M.C.; Kretzler M.; Wiggins R.C.; Naik A.S.,The growth hormone/IGF-1 axis is a risk factor for long-term kidney allograft failure,2025,JCI Insight ,10.1172/jci.insight.188485,"INTRODUCTION. Maladaptive hypertrophy, podocyte stress, and depletion contribute to kidney function decline. Although insulin-like growth factor 1 (IGF-1) plays a key role in early hypertrophic responses in the single kidney state, its impact on kidney transplant (KTx) outcomes remains uncertain. This report tests the hypothesis that early IGF-1 exposure reduces KTx survival. METHODS. Population datasets compared incident death-censored graft failure (DCGF) rates by age at KTx (n = 366,404) with IGF-1 levels by age (n = 15,014). A clinical study of 216 KTx recipients evaluated the association of IGF-1 exposure with DCGF and secondary outcomes of proteinuria and biopsy-proven acute rejection. IGF-1 exposure was modeled using pre-KTx IGF-1 levels and donor kidney dose estimated from the donor/recipient body surface area ratio reflecting allograft hyperfiltration. The association of DCGF with an IGF1 SNP linked to high IGF-1 levels was assessed in 724 genotyped allograft recipients. Single-cell transcriptomic data from first-year post-KTx patients and binephric donors were compared to assess intrarenal cellular expression of IGF1, IGF1R, and growth hormone receptor (GHR) transcripts. RESULTS. DCGF risk by age at KTx paralleled IGF-1 levels by age. Higher IGF-1 exposure was associated with significantly increased risks of DCGF, proteinuria, and T cell–mediated rejection. Genotypic analysis showed a 50% increase in DCGF risk per risk allele at IGF1 expression quantitative trait locus rs35767. First-year biopsy results revealed no increase in intrarenal IGF1 transcripts, while GHR and IGF1R transcripts were suppressed, consistent with circulating IGF-1 (vs. graft-derived IGF-1) being the primary source of IGF-1 exposure. CONCLUSION. We identify a role for the growth hormone/IGF-1 axis in reducing KTx survival. © 2025, Cusick et al.",,Final,All Open Access; Gold Open Access; Green Open Access,Scopus,2-s2.0-105007944190,[WARNING:NoKeywords]
Rhon-Calderon E.A.; Hemphill C.N.; Savage A.J.; Riesche L.; Schultz R.M.; Bartolomei M.S.,In vitro fertilization induces reproductive changes in male mouse offspring and has multigenerational effects,2025,JCI Insight ,10.1172/jci.insight.188931,"In vitro fertilization (IVF) is a noncoital method of conception used to treat human infertility. Although IVF is viewed as largely safe, it is associated with adverse outcomes in the fetus, placenta, and adult offspring. Because studies focusing on the effect of IVF on the male reproductive system are limited, we used a mouse model to assess the morphological and molecular effects of IVF on male offspring. We evaluated 3 developmental stages: 18.5-day fetuses and 12- and 39-week-old adults. Regardless of age, we observed changes in testicular-to-body weight ratios, serum testosterone levels, testicular morphology, gene expression, and DNA methylation. Also, sperm showed changes in morphology and DNA methylation. To assess multigenerational phenotypes, we mated IVF-conceived and naturally conceived males with wild-type females. Offspring from IVF males exhibited decreased fetal-to-placental weight ratios and changes in placenta gene expression and morphology regardless of sex. At 12 weeks of age, offspring showed higher body weights and differences in glucose, triglyceride, insulin, total cholesterol, HDL-C, and LDL/VLDL-C levels. Both sexes showed changes in gene expression in liver, testes, and ovaries and decreased global DNA methylation. Collectively, our findings demonstrate that male IVF offspring exhibit abnormal testicular and sperm morphology and molecular alterations with a multigenerational impact. © 2025, Rhon-Calderon et al.",,Final,All Open Access; Gold Open Access; Green Open Access,Scopus,2-s2.0-105003748227,[WARNING:NoKeywords]
Slusher A.L.; Santoro N.; Vash-Margita A.; Galderisi A.; Hu P.; Tokoglu F.; Li Z.; Tarabra E.; Strober J.; Vatner D.F.; Shulman G.I.; Caprio S.,ATGL links insulin dysregulation to insulin resistance in adolescents with obesity and hepatosteatosis,2025,Journal of Clinical Investigation,10.1172/JCI184740,"BACKGROUND. This study examined the underlying cellular mechanisms associated with insulin resistance (IR) and metabolic disease risk within subcutaneous adipose tissue (SAT) in youth with obesity and IR compared with those without IR. METHODS. Thirteen adolescents who were insulin sensitive (IS) and 17 adolescents with IR and obesity underwent a 3-hour oral glucose tolerance test and MRI to measure abdominal fat distribution and liver fat content. Lipolysis was determined by glycerol turnover ([2H5]-glycerol infusion) and adipose triglyceride lipase (ATGL) phosphorylation (Western blot) from SAT samples biopsied prior to and 30-minutes following insulin infusion during a hyperinsulinemic-euglycemic clamp (HEC). RESULTS. Glycerol turnover suppression during the HEC (first step) was lower in participants with IR compared with those with IS. Prior to insulin infusion, activated ATGL (reflected by the p-ATGL (Ser406)-to-ATGL ratio) was greater in participants with IR compared with those with IS and suppressed in response to a 30-minute insulin exposure in participants with IS, but not in those with IR. Lastly, greater ATGL inactivation is associated with greater glycerol suppression and lower liver fat. CONCLUSIONS. Insulin-mediated inhibition of adipose tissue lipolysis via ATGL is dysregulated among adolescents with IR compared with those with IS, thereby serving as a vital mechanism linking glucose and insulin dysregulation and ectopic lipid storage within the liver. © 2025, Slusher et al.",,Final,All Open Access; Gold Open Access,Scopus,2-s2.0-105000732966,[WARNING:NoKeywords]
Rajalingamgari P.; Khatua B.; Summers M.J.; Kostenko S.; Chang Y.-H.H.; Elmallahy M.; Anand A.; Pillai A.N.; Morsy M.; Trivedi S.; McFayden B.; Jahangir S.; Snozek C.L.H.; Singh V.P.,Prospective observational study and mechanistic evidence showing lipolysis of circulating triglycerides worsens hypertriglyceridemic acute pancreatitis,2025,Journal of Clinical Investigation,10.1172/JCI184785,"BACKGROUND. While most hypertriglyceridemia is asymptomatic, hypertriglyceridemia-associated acute pancreatitis (HTGAP) can be more severe than AP of other etiologies. The reasons underlying this are unclear. We thus examined whether lipolytic generation of nonesterified fatty acids (NEFAs) from circulating triglycerides (TGs) could worsen clinical outcomes. METHODS. Admission serum TGs, NEFA composition, and concentrations were analyzed prospectively for 269 patients with AP. These parameters, demographics, and clinical outcomes were compared between HTG-AP (TGs >500 mg/dL; American Heart Association [AHA] 2018 guidelines) and AP of other etiologies. Serum NEFAs were correlated with serum TG fatty acids (TGFAs) alone and with the product of TGFA serum lipase (NEFAs - TGFAs × lipase). Studies in mice and rats were conducted to understand the role of HTG lipolysis in organ failure and to interpret the NEFA-TGFA correlations. RESULTS. Patients with HTG-AP had higher serum NEFA and TG levels and more severe AP (19% vs. 7%; P < 0.03) than did individuals with AP of other etiologies. Correlations of long-chain unsaturated NEFAs with corresponding TGFAs increased with TG concentrations up to 500 mg/dL and declined thereafter. However, NEFA - TGFA × lipase correlations became stronger with TGs above 500 mg/dL. AP and intravenous lipase infusion in rodents caused lipolysis of circulating TGs to NEFAs. This led to multisystem organ failure, which was prevented by pancreatic TG lipase deletion or lipase inhibition. CONCLUSIONS. HTG-AP is made severe by the NEFAs generated from intravascular lipolysis of circulating TGs. Strategies that prevent TG lipolysis may be effective in improving clinical outcomes for patients with HTG-AP. Copyright:  © 2024, Rajalingamgari et al.",,Final,All Open Access; Gold Open Access; Green Open Access,Scopus,2-s2.0-85214320316,[WARNING:NoKeywords]
Hengel F.E.; Dehde S.; Kretz O.; Engesser J.; Zimmermann T.; Huber T.B.; Tomas N.M.,Passive transfer of patient-derived anti-nephrin autoantibodies causes a podocytopathy with minimal change lesions,2025,Journal of Clinical Investigation,10.1172/JCI186769,[No abstract available],,Final,All Open Access; Gold Open Access; Green Open Access,Scopus,2-s2.0-85219666150,[WARNING:NoKeywords]
Smith G.I.; Klein S.,Plasma endotrophin levels correlate with insulin resistance in people with obesity,2025,Journal of Clinical Investigation,10.1172/JCI190577,[No abstract available],,Final,All Open Access; Gold Open Access,Scopus,2-s2.0-105008534096,[WARNING:NoKeywords]
Ela A.; Peers G.; Pinder R.J.; Majeed A.; Budhathoki S.S.,"Social media interventions for non-communicable diseases: a call for a holistic approach considering eating disorders, mental health and wellbeing",2025,Journal of the Royal Society of Medicine,10.1177/01410768241290306,[No abstract available],,Final,All Open Access; Green Open Access,Scopus,2-s2.0-85210071357,[WARNING:NoKeywords]
Bendixen B.E.; Wilhelmsen-Langeland A.; Lomborg K.; Måkestad E.; Skogheim T.L.; Schønberg A.; Iversen M.M.; Kvale G.; Søfteland E.; Haugstvedt A.,Experiences With a Novel Micro-Choice-Based Concentrated Group Intervention for People With Type 2 Diabetes: A Qualitative Study,2025,Science of Diabetes Self-Management and Care,10.1177/26350106241304422,"Purpose: The purpose of this study was to explore experiences with an interdisciplinary micro-choice-based concentrated group intervention for people with type 2 diabetes. Methods: A qualitative study with individual semistructured interviews were conducted with 14 adults (8 women, ages 45-74 years) with type 2 diabetes. Purposive sampling was used, and participants from 3 different intervention groups in the micro-choice-based concentrated group intervention were recruited. Thematic analysis was used for the data analysis. Results: Three main themes were identified: (1) group intervention tailored to individual needs through friendly and skilled professionals, (2) valuable social interactions and an experience of fellowship, and (3) commitment to change through goal setting and conscious micro-choices. The participants described a readiness for change that was met by important knowledge from skilled professionals in the concentrated intervention. They reported that new knowledge, particularly about micro-choices and the focus on how insulin works in the body, led to change in their awareness and self-management. The concentrated group intervention was a preferred setting that contained a sense of community without compromising on meeting individual needs. Participants described internalized changes after the intervention and a willingness to adhere to changes necessary for their self-management. Conclusion: Study findings showed that a micro-choice-based concentrated group intervention for people with type 2 diabetes can be a valuable approach contributing to improved patient activation and diabetes self-management. The findings underpin the importance of increased diabetes knowledge and support from an interprofessional team to bring about significant changes in everyday life. © The Author(s) 2025.",,Final,All Open Access; Green Open Access,Scopus,2-s2.0-85216967256,[WARNING:NoKeywords]
Byrne C.; Ward S.; O'Sullivan J.; Chion A.; Lopes P.; Baci B.; Dowd C.; Jordan D.; Baker R.; Preston R.J.S.; Monopoli M.; Turecek P.L.; Kotsias M.; Cheeseman J.; Moran A.B.; Gardner R.A.; Spencer D.I.R.; Atiq F.; O'Donnell J.S.,Enhanced α2-3–linked sialylation determines the extended half-life of CHO-rVWF,2025,Blood,10.1182/blood.2024027038,"The half-life of recombinant human von Willebrand factor (rVWF) expressed in CHO cells (CHO-rVWF; Vonicog alfa; and Vonvendi/Veyvondi) is significantly longer than that of plasma-derived VWF (pdVWF). This finding is intriguing because CHO cells do not generate α2-6 sialylation, which constitutes the majority of human pdVWF sialylation. We hypothesized that glycan differences might regulate the longer half-life of CHO-rVWF. In lectin plate-binding assays and liquid chromatography–mass spectrometry analysis, we confirmed that CHO-rVWF lacked α2-6–linked sialylation. Conversely, however, α2-3–linked sialylation was significantly increased on CHO-rVWF, which also had reduced exposed β-galactose (β-Gal) compared to pdVWF. Consistent with human data, CHO-rVWF clearance was significantly (P < .001) reduced in VWF–/– mice compared to pdVWF. However, clearance of asialo-pdVWF and asialo–CHO-rVWF were identical. In keeping with the in vivo half-life prolongation, CHO-rVWF binding to murine macrophages (P = .012) and HepG2 cells (P = .001) was significantly decreased compared to pdVWF. Furthermore, CHO-rVWF binding to purified macrophage-galactose-type lectin (MGL) receptor and asialoglycoprotein receptor (ASGPR) was also significantly reduced. In contrast to pdVWF, in vivo studies in MGL1–/– mice and Asgr1–/– mice demonstrated that neither MGL nor ASGPR plays significant roles in regulating CHO-rVWF clearance. Together, our findings demonstrate that enhanced α2-3–linked sialylation on CHO-rVWF is responsible for its extended half-life. © 2025 American Society of Hematology",,Final,All Open Access; Hybrid Gold Open Access,Scopus,2-s2.0-105002662423,[WARNING:NoKeywords]
Valtis Y.K.; Devlin S.; Shouval R.; Rejeski K.; Corona M.; De Abia A.L.; Rivas-Delgado A.; Luttwak E.; Cassanello G.; Landego I.; Schöder H.; Bedmutha A.; Boardman A.; Shah G.L.; Scordo M.; Perales M.-A.; Salles G.; Palomba M.L.; Shah U.A.; Park J.H.,Cancer cachexia and weight loss before CAR T-cell therapy for lymphoma are independently associated with poor outcomes,2025,Blood Advances,10.1182/bloodadvances.2024014555,"Chimeric antigen receptor (CAR) T-cell therapy has transformed the care of lymphoma, yet many patients relapse. Several prognostic markers have been associated with CAR T-cell outcomes, such as tumor burden, response to bridging chemotherapy, and laboratory parameters at the time of lymphodepletion or infusion. The effect of cancer cachexia and weight loss before CAR T cells on toxicity and outcomes is not well understood. Here, we present a retrospective single-institution cohort study of 259 patients with lymphoma treated with CAR T cells between 2017 and 2023. We observed that patients with >5% decrease in their body mass index in the 3 months preceding CAR T-cell treatment (weight loss group; all meeting one of the commonly accepted definitions of cancer cachexia) had higher disease burden and inflammatory parameters (C-reactive protein, ferritin, interleukin-6, and tumor necrosis factor α) at the time of lymphodepletion and CAR T-cell infusion. Patients with weight loss experienced higher rates of grade 3+ neurotoxicity and early hematotoxicity, but those effects were not seen upon multivariable adjustment. However, in both univariate and multivariable analysis, patients with weight loss had worse response rates, overall survival, and event-free survival, indicating that weight loss is an independent poor prognostic factor. Our data suggest that weight loss in the 3 months preceding CAR T-cell therapy represents a worrisome “alarm signal” and a potentially modifiable factor, alongside tumor burden and inflammation, and warrants further investigation in patients treated with CAR T-cell therapy. © 2024 by The American Society of Hematology.",,Final,All Open Access; Gold Open Access; Green Open Access,Scopus,2-s2.0-85215275184,[WARNING:NoKeywords]
Palazzolo L.; Bassi I.; Guerrieri A.; Zompatori M.; Dalpiaz G.; Pisani L.,A puzzling case of pulmonary infiltrates in a young man with chronic kidney disease,2025,Breathe,10.1183/20734735.0174-2024,[No abstract available],,Final,All Open Access; Gold Open Access; Green Open Access,Scopus,2-s2.0-105000436428,[WARNING:NoKeywords]
