Authors,Title,Year,Source title,DI,Abstract,Author Keywords,Publication Stage,Open Access,Source,EID,OpenAlex_KW
Yin H.; Zhang Z.; Wang Y.; Song W.; Pu C.; Wang Y.; Jiang K.,Nano-enzymatic functionalized dual network hydrogel promotes tendon repair by modulating the inflammatory cycle and cellular behavior,2025,Biomaterials Science,10.1039/d5bm00441a,"Tendon injuries are prone to adhesions after repair, which in turn lead to limb dysfunction, which remains a major challenge in clinical treatment. Current research suggests that tendon injuries are affected by the accumulation of reactive oxygen species (ROS), inflammatory responses, and type III collagen deposition. These factors lead to an imbalance between extrinsic and intrinsic tendon healing and are the main reasons for the occurrence of peritendinous adhesions. In this study, we constructed a carrier using a polyvinyl alcohol/polyethylene glycol (PVA/PEG) dual network hydrogel and loaded it with zeolite imidazolium ester framework-8@CeO2 nano-enzymes (ZIF-8@CeO2) to form a nano-enzyme-functionalized hydrogel (PVA/PEG/ZIF-8@CeO2) therapeutic system. The surface of PVA/PEG/ZIF-8@CeO2 is rich in hydrophilic hydroxyl groups that form hydrogen bonds with water molecules, creating a hydrated layer that inhibits fibrin adsorption and fibroblast adhesion, reduces the impact of exogenous healing, and reduces the formation of adhesions. Similarly, the loaded ZIF-8@CeO2 has catalase (CAT) and superoxide dismutase (SOD) activities, which can effectively remove the excessive ROS in the injured tendon, down-regulate the inflammatory response, enhance the tendon differentiation of tendon stem cells, promote intrinsic healing, and ultimately promote the repair of injured tendons. Furthermore, the system can accelerate the transition from inflammation to repair and remodeling in the tendon healing process. The PVA/PEG/ZIF-8@CeO2 treatment system is a novel approach for reducing peritendinous adhesions and effectively promoting the repair of injured tendons. © 2025 The Royal Society of Chemistry.",,Final,,Scopus,2-s2.0-105009876966,[WARNING:NoKeywords]
Dey C.; Pal P.; Ghosh R.; Dey S.G.,Copper-Aβ and cytochrome c: a potential Janus in Alzheimer's disease,2025,Dalton Transactions,10.1039/d5dt01594d,"Aβ peptides and cytochrome c (Cyt c) co-exist in the mitochondria. The interplay between Aβ and Cyt c is thus, crucial in the context of Alzheimer's disease pathology, where oxidative stress and mitochondrial dysfunction are central features. However, the details of interaction between Cu bound Aβ and Cyt c remain unexplored at a molecular level. Previously it was demonstrated that reduced Cu-Aβ can react with O2 to result in H2O2. This H2O2 produced can oxidize neurotransmitters and this process is catalysed by the oxidized Cu-Aβ. Here spectroscopic analyses reveal that reduced Cu-Aβ transfers electron to oxidized Cyt c, which mitigates the production of reactive oxygen species (ROS) by reduced Cu-Aβ species. Thus, Cyt c can exhibit a protective role against ROS generation by Cu-Aβ. On the other hand, the oxidation of reduced Cyt c by H2O2 is significantly accelerated in the presence of Cu-Aβ, highlighting the thus far unknown intrinsic Cyt c peroxidase type activity of oxidized Cu-Aβ. Thus, the generation of oxidized Cyt c, catalyzed by Cu-Aβ, raises the possibility of apoptotic death of brain cells which is a common feature associated with AD, thereby revealing the other face of Janus. © 2025 The Royal Society of Chemistry.",,Final,,Scopus,2-s2.0-105012945252,[WARNING:NoKeywords]
Hashemi N.; Naderlou S.; Mohammadi A.; Danafar H.,An integrated computational and experimental study of BSA-coated MnFe2O4 nanoparticles as a drug delivery platform for quercetin,2025,Materials Advances,10.1039/d5ma00161g,"Quercetin, a bioactive flavonoid with limited bioavailability, was investigated using BSA-coated MnFe2O4 nanoparticles as a novel delivery system. An integrated computational and experimental approach was employed, combining DFT calculations and molecular docking simulations to analyze quercetin's interactions with the MnFe2O4 surface across (011), (101), and (100) facets, alongside in vitro studies to assess drug loading and release, biocompatibility, and cytotoxicity on 4T1 cells. Molecular docking showed favorable binding energies between quercetin and BSA (−5.17 kcal mol−1 with Subdomain IIA), demonstrating that quercetin, even when bound to the BSA coating, retained strong interactions with the oxide surface. Reduced density gradient (RDG) analysis revealed facet-dependent adsorption mechanisms, correlating binding affinity towards Mn (through oxygen-containing functional groups) with steric interactions shown as red areas on the RDG plot. Analysis unveiled the interactions and structural features of each facet of the drug complex. Experimentally, the TEM imaging revealed the nanoparticles to possess a spherical morphology with an average diameter of around 7 nanometers and the average size of nanoparticles by DLS is 85.27 ± 0.26 nm with a PDI of 0.25. The BSA coating improved drug loading to 27.5% and resulted in a dose-dependent cytotoxic effect on 4T1 tumor cells. Specifically, a release of 62% of the loaded quercetin was observed at pH 5.7 after 120 hours, compared to only 41% at pH 7.4. The in vitro assessment also demonstrated high biocompatibility, with less than 5% hemolysis observed at concentrations up to 200 μg mL−1. In vivo studies show no mouse death in the test of LD50. Overall, these findings support the potential of BSA-coated MnFe2O4 nanoparticles as a promising drug delivery platform to enhance quercetin's stability and bioavailability for effective tumor growth inhibition. © 2025 RSC.",,Final,All Open Access; Gold Open Access,Scopus,2-s2.0-105002408623,[WARNING:NoKeywords]
Mei X.; Stewart R.C.; Zhou X.Z.; Lu K.P.; Gillies E.R.,Covalent cross-linking approaches for all-trans retinoic acid-loaded thermo-responsive hydrogels,2025,Soft Matter,10.1039/d5sm00228a,"All-trans retinoic acid (ATRA) is a promising therapeutic for the treatment of a wide range of cancers. However, its short half-life, poor water-solubility, and low stability in vivo hinder its use. The development of injectable controlled release systems for ATRA delivery can potentially address these challenges. Building on a poly(caprolactone-co-lactide)-poly(ethylene glycol)-poly(caprolactone-co-lactide) (PCLA-PEG-PCLA) triblock copolymer system that undergoes thermo-responsive gelation at 37 °C, we explore and compare different approaches to stabilize the gels through covalent bonding. The attempted cross-linking of methacrylate end-capped PCLA-PEG-PCLA through thiol-Michael addition reactions using small molecule and 4-arm-PEG thiols led to precipitation rather than gelation. However, azide end-capped PCLA-PEG-PCLA was gelled using 5 kg mol−1 4-arm-PEG with terminal dibenzocyclooctyne (DIBAC) groups by strain-promoted azide-alkyne cycloaddition. This hydrogel was then compared with previously reported methacrylate end-capped PCLA-PEG-PCLA hydrogels cross-linked by free radical chemistry, as well as non-covalently cross-linked hydrogels. The azide-alkyne hydrogels exhibited properties intermediate between the free radical and non-covalently cross-linked gels. Incorporation of ATRA substantially disrupted the free radical cross-linking, but imparted only modest changes in the azide-alkyne gels. ATRA was released over about two weeks. The proliferation of MDA-MB-468 cells in the presence of ATRA-loaded and control azide-alkyne gels was investigated. The ATRA-loaded gel released active drug, while the unloaded gel did not affect proliferation. © 2025 The Royal Society of Chemistry.",,Final,All Open Access; Hybrid Gold Open Access,Scopus,2-s2.0-105006520195,[WARNING:NoKeywords]
McArdle Z.; Singh R.R.; Walton S.L.; Moritz K.M.; Denton K.M.; Schreuder M.F.,Renal hypertrophy and hyperfiltration is enhanced in early acquired compared with a congenital solitary function kidney model in sheep,2025,Clinical Science,10.1042/CS20243031,"A congenital solitary functioning kidney (C-SFK) or an early acquired SFK (EA-SFK), due to childhood unilateral nephrectomy (UNX), increases the risk of hypertension and kidney disease early in life. Evidence suggests that children with an EA-SFK may have a higher risk of future kidney disease compared with those with a C-SFK, but the precise underlying mechanisms need further investigation. C-SFK was induced by fetal UNX at 100 days gestation (term=150 days) in male sheep fetuses, and a sham procedure was performed. At approximately one month of age, EA-SFK was induced by UNX in male lambs. At eight months of age, total kidney weight was similar in all groups due to marked hypertrophy in the C-SFK and EA-SFK groups. Blood pressure was similar in EA-SFK and sham groups but ~12 mmHg higher in the C-SFK group compared with sham. Compared with the sham group, glomerular filtration rate (GFR) was ~9% less in the EA-SFK group and ~26% less in the C-SFK. GFR was ~23% higher in EA-SFK compared with the C-SFK group. Albuminuria was ~67% higher in C-SFK sheep but similar in the EA-SFK group compared with sham sheep. However, like the C-SFK group, the renal blood flow response to nitric oxide blockade was attenuated in the EA-SFK group compared with sham. In conclusion, long-term studies are needed to determine whether the higher hyperfiltration and disturbed vasodilator balance observed in EA-SFK sheep will cause an accelerated decline in renal function with aging. © 2025 The Author(s).",,Final,All Open Access; Hybrid Gold Open Access,Scopus,2-s2.0-86000796071,[WARNING:NoKeywords]
Spreinat A.; Kunz W.; Maack C.H.; Wilczek C.; Nestler B.; Ernst A.,Fluid propagation and protein adsorption patterns in porous nitrocellulose membranes for lateral flow assays,2025,Physics of Fluids,10.1063/5.0257343,"Lateral flow assays (LFAs) have caught new attention in recent years due to extensive use in the containment of the COVID-19 pandemic. Especially the protein and fluid interactions with the nitrocellulose membrane structure are yet to be fully investigated, which affect the fluid and protein distribution of the test and control lines differently due to different adsorptive properties of fluids and proteins. Therefore, the relationship between fluid spread and protein distribution, respectively, and structure needs systematic evaluation. Two procedures were developed based on passive adsorption of complementary fluorescent dyes to investigate these phenomena. These procedures enabled three-dimensional visualization of the membrane structure, fluid as well as the protein spreading, respectively. Confocal laser scanning microscopy was applied after depositing picoliter and nanoliter volumes of the printing buffers containing fluorophore-labeled proteins (immunoglobulin G) and Oregon Green™ 488 onto the membrane using a high precision micro dispenser. The resulting data were correlated with the membrane's tortuosity and permeability. Inverse-proportional dependencies for the lateral spread of the fluid and protein adsorption with the structural parameters were observed. Additionally, surfactants [polysorbate 80 (PS80) and sodium dodecylbenzenesulfonate (SDBS), both at 0.1%] were added individually to the buffers, and the spread of the liquids was evaluated. Both surfactants increase the similarities between fluid and protein shape compared to the reference data. While SDBS increases the general lateral spread, PS80 does increase the penetration depth of the protein into the membrane, which could lead to reduced signal in LFAs. © 2025 Author(s).",,Final,All Open Access; Hybrid Gold Open Access,Scopus,2-s2.0-105000033880,[WARNING:NoKeywords]
Vlogman T.; van der Hoek J.; Snoeijink T.; Hagmeijer R.; Groot Jebbink E.; Jain K.,Impact of injection velocity on catheter-based drug delivery in bifurcating vessels: In silico and in vitro analysis,2025,Physics of Fluids,10.1063/5.0263975,"Many biomedical applications involve the transport of fluid and/or particles in bifurcating vessels, such as aerosol transport in the lungs and transarterial radioembolization (TARE). Inspired by TARE, we study the injection of fluid via a catheter in an idealized liver vasculature through experiments and lattice Boltzmann simulations. First, we validate the simulations using in vitro experiments of dye injected through a catheter. Then, we investigate the impact of catheter injection velocity on the distribution of injected fluid. The sensitivity of the distributions to changes in flow rate is low at catheter flow rates Q c ≤ 6 mL min − 1 and Q c ≥ 11 mL min − 1 , while in the intermediate regime, changes in flow rate of only 2 ml/min lead to changes in distribution of more than 50%. This is shown to originate from changes in the flow field in the first bifurcation. Specifically, the sensitivity to flow rate becomes large as the jet breakdown length approaches the distance to the first bifurcation. Our work represents a first step toward a fundamental understanding of the effect of injection velocity in TARE and similar applications. © 2025 Author(s).",,Final,All Open Access; Hybrid Gold Open Access,Scopus,2-s2.0-105002733636,[WARNING:NoKeywords]
Mustafa S.; Cannon C.; Keenan R.; Mikaere M.; Dehar T.; Moorhouse S.; Thompson J.; Chepulis L.,Evaluating the impact of the Piki te Ora extended primary care team on clinical outcomes in type 2 diabetes patients: a retrospective study,2025,Journal of primary health care,10.1071/HC24108,"Introduction Type 2 diabetes (T2D) is a significant health issue in New Zealand with a disproportionate effect for Māori. To address inequities and optimise care, Te Korowai Hauora o Hauraki, an Iwi Māori health provider, established the 'Piki te Ora service' to support its five rural clinics by providing culturally safe, multidisciplinary support for patients with T2D. Aim This study aimed to undertake a service review, describing and evaluating the available clinical data, of the Piki te Ora service. Methods Patients enrolled in the Piki te Ora service between January 2021 and March 2024 were invited to have their data (sociodemographic, HbA1c, cholesterol and blood pressure) included in the review. Frequency and mode of health care/patient contact were also explored. Results A total of 112 patients were contacted and 64 (mean age 58years, 62.5% Māori) consented to data review. Over 6months, patients in the Piki te Ora service were contacted an average of 9.5 times, with phone calls being the predominant mode of contact. Median HbA1c levels significantly decreased by 16.0mmol/mol at 6months post enrolment in the Piki te Ora service (P =0.011) but no significant changes were observed in cholesterol or blood pressure. Discussion The Piki te Ora service appears to provide effective support for T2D management, particularly glycaemic control, however more clinical data is needed to evaluate its effectiveness. Its flexible and accessible approach, including free consultations, may enhance care accessibility, especially for economically deprived patients.",,Final,All Open Access; Gold Open Access,Scopus,2-s2.0-105002485509,[WARNING:NoKeywords]
Mustafa S.; Cannon C.; Keenan R.; Mikaere M.; Dehar T.; Moorhouse S.; Thompson J.; Chepulis L.,Corrigendum to: Evaluating the impact of the Piki te Ora extended primary care team on clinical outcomes in type 2 diabetes patients: a retrospective study,2025,Journal of primary health care,10.1071/HC24108_CO,[No abstract available],,Final,All Open Access; Gold Open Access,Scopus,2-s2.0-105002484835,[WARNING:NoKeywords]
Cai H.; Chen Y.; Li J.-C.; Wang Y.-X.; Chen A.-K.; Jia H.-J.,A Novel Nutrition-Related Prognostic Biomarker for Predicting Survival in Patients with Colorectal Cancer,2025,Nutrition and Cancer,10.1080/01635581.2024.2412356,"Background: Colorectal cancer (CRC) is a prevalent global malignancy with substantial morbidity and mortality. Accurate prognostic evaluation is essential in CRC patient management. This study investigates the prognostic significance of red blood cell count (RBC) and Onodera’s prognostic nutritional index (OPNI) in resectable CRC patients. Methods: A retrospective analysis of 210 CRC patients undergoing radical resection (January 2015–January 2017) assessed clinical and hematological factors, including RBC, albumin, hemoglobin, and OPNI. A novel comprehensive biomarker, R-OPNI, combining preoperative RBC with OPNI, was introduced. Correlations with patient survival were analyzed, and R-OPNI’s independent prognostic value was assessed through univariate and multivariate Cox models. Predictive ability was compared to other factors using the receiver operating characteristic (ROC) method. Results: Higher RBC levels (≥ 3.9 × 1012/L) and elevated OPNI were associated with significantly improved overall survival. Lower R-OPNI scores (0 or 1) indicated notably poorer survival. Multivariate analysis confirmed R-OPNI’s independent prognostic significance (HR: 0.273, 95% CI: 0.098–0.763, p = 0.013). R-OPNI (AUC = 0.732) demonstrated superior predictive value compared to individual prognostic factors. Conclusion: R-OPNI emerges as a robust, independent prognostic predictor for resectable CRC patients, emphasizing the importance of assessing preoperative nutritional status. © 2024 Taylor & Francis Group, LLC.",,Final,All Open Access; Green Open Access,Scopus,2-s2.0-85206112738,[WARNING:NoKeywords]
Lu S.; Zhou Q.; Liu X.; Du Y.; Fan Y.; Cheng Y.; He S.; Zhao H.; Li H.; Wu Y.-L.,Plain language summary: updated results of lorlatinib treatment in people with advanced NSCLC from China,2025,Future Oncology,10.1080/14796694.2024.2426376,[No abstract available],,Final,All Open Access; Green Open Access; Hybrid Gold Open Access,Scopus,2-s2.0-85211147556,[WARNING:NoKeywords]
Shatsnimitkul E.; Laopeamthong I.; Tansawet A.; Techapongsatorn S.; Kasetsermwiriya W.; Leungon P.; Sukhvibul P.,High-volume lactated Ringer’s solution with human albumin versus standard-volume infusion as a prophylactic treatment for post-endoscopic retrograde cholangiopancreatography pancreatitis: randomized clinical trial,2025,BJS Open,10.1093/bjsopen/zrae149,"Background: Adverse events after endoscopic retrograde cholangiopancreatography (ERCP) are rare, and post-ERCP pancreatitis is a serious adverse event. This study aimed to determine the role of aggressive intravenous hydration with lactated Ringer’s solution at a specific volume with 20% human albumin before ERCP in reducing the incidence of post-ERCP pancreatitis. Methods: This study was a single-centre randomized clinical trial. The participants were randomly assigned to two groups: those who received aggressive intravenous hydration with 20% human albumin and lactated Ringer's solution (intervention group), and those who received standard-volume intravenous hydration with lactated Ringer's solution (control group). The primary endpoint was post-ERCP pancreatitis. Participants and outcome assessors were blinded to treatment allocation. Comparison was performed using the chi-square, the Fisher’s exact, the Student’s t, or the Mann–Whitney U tests, where appropriate. Results: Of 300 randomized participants, 149 and 144 participants from the intervention and control group were included in the analysis. There was no significant difference in the post-ERCP pancreatitis rate (n = 10; 6.7% versus n = 9; 6.3%, P = 0.873) between the intervention and control groups. High-risk procedures (that is pancreatic duct wiring, pancreatic duct injection, precut sphincterotomy, and balloon dilation of the ampulla) were significantly associated with post-ERCP pancreatitis compared with low-risk procedures (n = 15; 15% versus n = 4; 2.1%, P < 0.001). In the high-risk procedures population, the intervention and control groups had increased post-ERCP pancreatitis rates (P = 0.716). Two participants in each group developed pulmonary congestion. Conclusion: Aggressive peri-ERCP intravenous hydration with lactated Ringer's solution combined with 50 ml of 20% human albumin did not prevent post-ERCP pancreatitis. None of the subgroups presented with prophylactic effects. © The Author(s) 2025. Published by Oxford University Press on behalf of BJS Foundation Ltd.",,Final,All Open Access; Gold Open Access; Green Open Access,Scopus,2-s2.0-85216508520,[WARNING:NoKeywords]
Park B.; Vandal A.; Welsh F.; Eglinton T.; Koea J.; Taneja A.; Barazanchi A.; Hill A.G.; MacCormick A.D.,"Sarcopenia, myosteatosis, and frailty parameters to predict adverse outcomes in patients undergoing emergency laparotomy: prospective observational multicentre cohort study",2025,BJS Open,10.1093/bjsopen/zraf016,"Background: Functional compromise contributes significantly to adverse outcomes after emergency laparotomy. Sarcopenia, defined as reduced muscle strength and muscle quantity, has been seldom assessed in patients undergoing emergency laparotomy. The aim of this study was to examine functional compromise in emergency laparotomy using sarcopenia, myosteatosis, and frailty parameters and evaluate impacts on functional and patient-centred outcomes. Methods: Patients aged greater than or equal to 55 years who underwent emergency laparotomy and preoperative computed tomography (CT) at two hospitals in New Zealand between February 2022 and October 2023 were included in a prospective database. Sarcopenia was measured using the SARC-F questionnaire, isokinetic dynamometry to measure hand grip strength, and skeletal muscle quantity according to CT. Myosteatosis was determined using CT and frailty was assessed using the Clinical Frailty Scale. Predictors for rehabilitation, days alive and out of hospital at 90 days, and risk of not returning home were analysed using relative risk and proportional means regression. Secondary outcomes were 3- and 6-month mortality and inpatient morbidity defined using the Clavien–Dindo classification. Results: A total of 101 patients undergoing emergency laparotomy during the study interval were analysed; 21.6% of participants had sarcopenia, 34.7% had myosteatosis, and 24.8% were living with frailty. Muscle strength parameters (low grip strength and a positive SARC-F questionnaire) had significant relationships with primary outcomes. Low grip strength (less than 27 kg for male patients and less than 16 kg for female patients) was most significant for risk of admission for rehabilitation (adjusted risk ratio 5.48 (95% c.i. 2.03 to 14.82)). A positive SARC-F questionnaire (an overall score of greater than or equal to 4 out of 10) was most significant for not returning home (adjusted risk ratio 8.26 (95% c.i. 1.81 to 37.76)). Isolated low muscle quantity (less than 52.4 cm2/m2 for male patients and less than 38.5 cm2/m2 for female patients) demonstrated no relationship. Being frail was most significant for a reduced number of days alive and out of hospital at 90 days (−13.4% compared with non-frail participants (95% c.i. −24.3% to −0.8%)). Sarcopenia and low grip strength were the only parameters to demonstrate a relationship with 3- and 6-month mortality. Conclusion: Sarcopenia and frailty parameters are major determinants of functional compromise and predict adverse outcomes after emergency laparotomy. Muscle strength is more important than mass, and measurable without imaging, streamlining its clinical application. © The Author(s) 2025. Published by Oxford University Press on behalf of BJS Foundation Ltd.",,Final,All Open Access; Gold Open Access; Green Open Access,Scopus,2-s2.0-105002242845,[WARNING:NoKeywords]
Røys E.Å.; Viste K.; Kellmann R.; Guldhaug N.A.; Alaour B.; Sylte M.S.; Torsvik J.; Strand H.; Marber M.; Omland T.; Theodorsson E.; Jones G.R.D.; Aakre K.M.,Estimating Reference Change Values Using Routine Patient Data: A Novel Pathology Database Approach,2025,Clinical Chemistry,10.1093/clinchem/hvae166,"BACKGROUND: The reference change value (RCV) is calculated by combining the within-subject biological variation (CVI) and local analytical variation (CVA). These calculations do not account for the variation seen in preanalytical conditions in routine practice or CVI in patients presenting for treatment. As a result, the RCVs may not reflect routine practice or align with clinicians’ experiences. We propose a novel RCV approach based on routine patient data that is potentially more clinically relevant. METHODS: This study used the refineR algorithm to determine RCVs using serial patient data extracted from a local Laboratory Information System (LIS). The model was applied to biomarkers with a range of result ratio distributions varying from normal to log-normal. Results were compared against conventional formula-based RCVs using CVI estimates from a state-of-the-art biological variation study. Monte Carlo simulations were also used to validate the LIS data approach. RESULTS: The RCVs estimated from LIS data were: 11-deoxycortisol (men): −70%/+196%, 17-hydroxyproges-terone (men): −49%/+100%, albumin: −10%/+11%, androstenedione (men): −47%/+96%, cortisol (men): −54%/+51%, cortisone (men): −32%/+51%, creatinine: −16%/+14%, phosphate (women): −23%/+29%, phosphate (men): −27%/+29%, testosterone (men): −38%/+60%. The formula-based RCV estimates showed similar but slightly lower results, and the Monte Carlo simulations confirmed the applicability of the new approach. CONCLUSIONS: RCVs may be estimated from patient results without prior assumptions about the shape of the ratios between serial results. Laboratories can determine RCVs based on local practice and population. © Association for Diagnostics & Laboratory Medicine 2024.",,Final,All Open Access; Hybrid Gold Open Access,Scopus,2-s2.0-85214089523,[WARNING:NoKeywords]
